{
  "schema": "shiftory.explanation/v1",
  "summary": "Remove email validation regex and validate_email function from validators.py, and add a simplified validate_email function to utils.py.",
  "items": [
    {
      "id": "item_remove_validators_email",
      "kind": "behavioral",
      "title": "Remove validate_email and EMAIL_RE from validators.py",
      "confidence": "inferred",
      "absence": "after",
      "before": "validators.py defines EMAIL_RE regex pattern and validate_email(value) which validates email addresses against the regular expression r\"^[^@\\s]+@[^@\\s]+\\.[^@\\s]+$\".",
      "after": null,
      "citations": [
        "source_81f13c7533f4e927fdf81ce9"
      ]
    },
    {
      "id": "item_add_utils_email",
      "kind": "behavioral",
      "title": "Add validate_email function to utils.py",
      "confidence": "inferred",
      "absence": "before",
      "before": null,
      "after": "utils.py defines validate_email(value) which checks whether '@' is present in value.",
      "citations": [
        "source_3c2a01bc85a8eea0eccf3f2a"
      ]
    }
  ],
  "coverage_owners": [
    {
      "evidence_id": "line_4579b3edeb1eb6e1b8e6b064",
      "owner_id": "item_remove_validators_email"
    },
    {
      "evidence_id": "line_da03d3caaa71908ec97e4cfd",
      "owner_id": "item_remove_validators_email"
    },
    {
      "evidence_id": "line_7b4602e55ffd4b12ad595d67",
      "owner_id": "item_remove_validators_email"
    },
    {
      "evidence_id": "line_13072f4b3d47a51c87aa3458",
      "owner_id": "item_remove_validators_email"
    },
    {
      "evidence_id": "line_b0dd9157dfad77ee29519708",
      "owner_id": "item_remove_validators_email"
    },
    {
      "evidence_id": "line_adf3b5448baa5d63f946312f",
      "owner_id": "item_remove_validators_email"
    },
    {
      "evidence_id": "line_3d28e5c6ce7e3ed65c09ac9e",
      "owner_id": "item_add_utils_email"
    },
    {
      "evidence_id": "line_1c51808635779198aa73d32c",
      "owner_id": "item_add_utils_email"
    },
    {
      "evidence_id": "line_7d36ca8a0961de176ecb84f2",
      "owner_id": "item_add_utils_email"
    },
    {
      "evidence_id": "line_f4f9bb3553a8a40591a52b03",
      "owner_id": "item_add_utils_email"
    }
  ]
}
