{
  "schema": "shiftory.explanation/v1",
  "summary": "Adjust network retry loop configuration in fetch_with_retry by shortening request timeout and increasing maximum attempt count.",
  "items": [
    {
      "id": "item_retry_config",
      "kind": "behavioral",
      "title": "Shorten request timeout from 30s to 5s and increase maximum retry attempts from 1 to 4",
      "confidence": "extracted",
      "before": "fetch_with_retry uses a 30-second timeout and allows only 1 attempt with no retries on timeout.",
      "after": "fetch_with_retry uses a 5-second timeout and allows up to 4 attempts (up to 3 retries after 1-second delays) on timeout.",
      "citations": [
        "source_a14ea6cf1eeef1573ed8855d",
        "source_80d49b9bcd5c7145d90c4a38"
      ]
    }
  ],
  "coverage_owners": [
    {
      "evidence_id": "line_bb015cfee40312bfd8fb5b55",
      "owner_id": "item_retry_config"
    },
    {
      "evidence_id": "line_46fd66b2be752ae32924a636",
      "owner_id": "item_retry_config"
    },
    {
      "evidence_id": "line_ef3a2e79e8b24ae75a615833",
      "owner_id": "item_retry_config"
    },
    {
      "evidence_id": "line_cb5e9cae2000dffb76b88172",
      "owner_id": "item_retry_config"
    }
  ]
}
